{
  "_source": "Chapter-level comparison of curator rolls.json vs regex roll_locations_regex.json events for chapters 1-75 (curator coverage). Stage-1 sanity check: do we have enough regex anchors per chapter for a downstream LLM pass to align each curator roll with its narrative anchor?",
  "_method": "Per chapter: count curator entries (kind in {roll, miss, trigger}) vs regex events (anchor_kind in {constellation_reveal, miss, roll_attempt, acquisition} — 'general' excluded as too vague). A chapter is 'undercollected' if regex events < curator events. The headline coverage_pct = sum(min(regex, curator)) / sum(curator) across all curator-covered chapters.",
  "_scope": "chapters 1-75 (curator log coverage)",
  "_findings": [
    {
      "name": "curator vs simulator: structural-zero chapters",
      "chapters": [
        "6.1",
        "8.1",
        "43.1",
        "46.1",
        "55.1",
        "74.2"
      ],
      "prose_evidence": "These chapters have ZERO sections with counts_for_cp=true. The simulator (which follows the author's '2000 words of MC POV per 100 CP' rule) predicts no rolls in them. The prose contains no roll narration. The curator nevertheless logged rolls in these chapters — this is the curator ticking 100-CP boundaries on raw word count, regardless of MC vs non-MC. Curator log is bookkeeping-divergent here, NOT a regex blind spot.",
      "actionable": false
    },
    {
      "name": "curator vs simulator: bookkeeping ≠ narration",
      "chapters": [
        "58"
      ],
      "prose_evidence": "Confirmed by reading prose: ch 58 has 2,506 CP-earning words → simulator predicts 1 roll → prose narrates 1 roll (Size constellation → Nano-technician at offset 53658, anchor 'the Size constellation'). The curator logged 6 entries (Roll 407-411 + 1 annotation), but Rolls 407-410 are tagged '???→Miss' — they're CP-bank ticks during ch 58's non-MC sections (Preamble Survey + interlude content), not narrated roll events. Earlier (now-superseded) finding claimed this was 'buildup-phrase compression'; that interpretation was incorrect — the simulator and prose match 1:1, the curator's count is what diverges.",
      "actionable": false
    },
    {
      "name": "curator vs simulator: minor count drift in main chapters",
      "chapters": [
        "3",
        "16",
        "17",
        "43",
        "54",
        "56",
        "58.2",
        "66"
      ],
      "prose_evidence": "Same structural cause as ch 58: curator counts every 100-CP boundary crossing on raw words, simulator counts only on MC-POV words, prose narrates only the events the author chose to write. The drift is small in these chapters because they have proportionally more MC POV. For ground truth, prefer data/derived/roll_text_evidence.json (each predicted roll's prose window is captured directly from the EPUB).",
      "actionable": false
    }
  ],
  "coverage_excluding_structural_zeros": {
    "curator_total_excluding_zero_mc_chapters": 468,
    "covered": 451,
    "coverage_pct": 96.4
  },
  "totals": {
    "curator_hits": 190,
    "curator_misses": 305,
    "curator_triggers": 1,
    "curator_total": 496,
    "regex_constellation_reveals": 340,
    "regex_misses_in_curator_chapters": 110,
    "covered_in_curator_chapters": 451,
    "chapter_coverage_pct": 90.9,
    "chapters_undercollected": 15,
    "chapters_undercollected_list": [
      "3",
      "6.1",
      "8.1",
      "16",
      "17",
      "43",
      "43.1",
      "46.1",
      "54",
      "55.1",
      "56",
      "58",
      "58.2",
      "66",
      "74.2"
    ],
    "chapters_with_curator_rolls": 82
  },
  "per_chapter": [
    {
      "chapter_num": "1",
      "curator_hits": 0,
      "curator_misses": 1,
      "curator_triggers": 1,
      "regex_constellation_reveal": 1,
      "regex_miss": 1,
      "regex_roll_attempt": 1,
      "regex_acquisition": 0,
      "regex_total": 3,
      "undercollected": false
    },
    {
      "chapter_num": "2",
      "curator_hits": 3,
      "curator_misses": 1,
      "curator_triggers": 0,
      "regex_constellation_reveal": 3,
      "regex_miss": 1,
      "regex_roll_attempt": 3,
      "regex_acquisition": 0,
      "regex_total": 7,
      "undercollected": false
    },
    {
      "chapter_num": "3",
      "curator_hits": 2,
      "curator_misses": 1,
      "curator_triggers": 0,
      "regex_constellation_reveal": 2,
      "regex_miss": 0,
      "regex_roll_attempt": 0,
      "regex_acquisition": 0,
      "regex_total": 2,
      "undercollected": true
    },
    {
      "chapter_num": "4",
      "curator_hits": 3,
      "curator_misses": 2,
      "curator_triggers": 0,
      "regex_constellation_reveal": 4,
      "regex_miss": 0,
      "regex_roll_attempt": 0,
      "regex_acquisition": 1,
      "regex_total": 5,
      "undercollected": false
    },
    {
      "chapter_num": "5",
      "curator_hits": 1,
      "curator_misses": 0,
      "curator_triggers": 0,
      "regex_constellation_reveal": 1,
      "regex_miss": 0,
      "regex_roll_attempt": 0,
      "regex_acquisition": 0,
      "regex_total": 1,
      "undercollected": false
    },
    {
      "chapter_num": "6",
      "curator_hits": 3,
      "curator_misses": 2,
      "curator_triggers": 0,
      "regex_constellation_reveal": 2,
      "regex_miss": 2,
      "regex_roll_attempt": 1,
      "regex_acquisition": 0,
      "regex_total": 5,
      "undercollected": false
    },
    {
      "chapter_num": "6.1",
      "curator_hits": 0,
      "curator_misses": 1,
      "curator_triggers": 0,
      "regex_constellation_reveal": 0,
      "regex_miss": 0,
      "regex_roll_attempt": 0,
      "regex_acquisition": 0,
      "regex_total": 0,
      "undercollected": true
    },
    {
      "chapter_num": "7",
      "curator_hits": 2,
      "curator_misses": 2,
      "curator_triggers": 0,
      "regex_constellation_reveal": 4,
      "regex_miss": 0,
      "regex_roll_attempt": 0,
      "regex_acquisition": 0,
      "regex_total": 4,
      "undercollected": false
    },
    {
      "chapter_num": "8",
      "curator_hits": 2,
      "curator_misses": 0,
      "curator_triggers": 0,
      "regex_constellation_reveal": 3,
      "regex_miss": 0,
      "regex_roll_attempt": 0,
      "regex_acquisition": 0,
      "regex_total": 3,
      "undercollected": false
    },
    {
      "chapter_num": "8.1",
      "curator_hits": 1,
      "curator_misses": 2,
      "curator_triggers": 0,
      "regex_constellation_reveal": 0,
      "regex_miss": 0,
      "regex_roll_attempt": 0,
      "regex_acquisition": 0,
      "regex_total": 0,
      "undercollected": true
    },
    {
      "chapter_num": "9",
      "curator_hits": 2,
      "curator_misses": 1,
      "curator_triggers": 0,
      "regex_constellation_reveal": 2,
      "regex_miss": 0,
      "regex_roll_attempt": 1,
      "regex_acquisition": 1,
      "regex_total": 4,
      "undercollected": false
    },
    {
      "chapter_num": "10",
      "curator_hits": 3,
      "curator_misses": 3,
      "curator_triggers": 0,
      "regex_constellation_reveal": 3,
      "regex_miss": 2,
      "regex_roll_attempt": 1,
      "regex_acquisition": 2,
      "regex_total": 8,
      "undercollected": false
    },
    {
      "chapter_num": "11",
      "curator_hits": 3,
      "curator_misses": 5,
      "curator_triggers": 0,
      "regex_constellation_reveal": 7,
      "regex_miss": 0,
      "regex_roll_attempt": 3,
      "regex_acquisition": 2,
      "regex_total": 12,
      "undercollected": false
    },
    {
      "chapter_num": "12",
      "curator_hits": 1,
      "curator_misses": 0,
      "curator_triggers": 0,
      "regex_constellation_reveal": 1,
      "regex_miss": 0,
      "regex_roll_attempt": 0,
      "regex_acquisition": 0,
      "regex_total": 1,
      "undercollected": false
    },
    {
      "chapter_num": "13",
      "curator_hits": 1,
      "curator_misses": 4,
      "curator_triggers": 0,
      "regex_constellation_reveal": 4,
      "regex_miss": 1,
      "regex_roll_attempt": 0,
      "regex_acquisition": 0,
      "regex_total": 5,
      "undercollected": false
    },
    {
      "chapter_num": "14",
      "curator_hits": 4,
      "curator_misses": 2,
      "curator_triggers": 0,
      "regex_constellation_reveal": 5,
      "regex_miss": 0,
      "regex_roll_attempt": 2,
      "regex_acquisition": 0,
      "regex_total": 7,
      "undercollected": false
    },
    {
      "chapter_num": "15",
      "curator_hits": 2,
      "curator_misses": 3,
      "curator_triggers": 0,
      "regex_constellation_reveal": 7,
      "regex_miss": 1,
      "regex_roll_attempt": 0,
      "regex_acquisition": 1,
      "regex_total": 9,
      "undercollected": false
    },
    {
      "chapter_num": "16",
      "curator_hits": 1,
      "curator_misses": 3,
      "curator_triggers": 0,
      "regex_constellation_reveal": 2,
      "regex_miss": 1,
      "regex_roll_attempt": 0,
      "regex_acquisition": 0,
      "regex_total": 3,
      "undercollected": true
    },
    {
      "chapter_num": "17",
      "curator_hits": 3,
      "curator_misses": 3,
      "curator_triggers": 0,
      "regex_constellation_reveal": 2,
      "regex_miss": 2,
      "regex_roll_attempt": 1,
      "regex_acquisition": 0,
      "regex_total": 5,
      "undercollected": true
    },
    {
      "chapter_num": "18",
      "curator_hits": 3,
      "curator_misses": 3,
      "curator_triggers": 0,
      "regex_constellation_reveal": 5,
      "regex_miss": 1,
      "regex_roll_attempt": 0,
      "regex_acquisition": 0,
      "regex_total": 6,
      "undercollected": false
    },
    {
      "chapter_num": "19",
      "curator_hits": 4,
      "curator_misses": 4,
      "curator_triggers": 0,
      "regex_constellation_reveal": 8,
      "regex_miss": 1,
      "regex_roll_attempt": 0,
      "regex_acquisition": 1,
      "regex_total": 10,
      "undercollected": false
    },
    {
      "chapter_num": "20",
      "curator_hits": 2,
      "curator_misses": 3,